=== nvme0n1 ===
smartctl 7.4 2024-10-15 r5620 [x86_64-linux-6.17.13-2-pve] (local build)
Copyright (C) 2002-23, Bruce Allen, Christian Franke, www.smartmontools.org

=== START OF INFORMATION SECTION ===
Model Number:                       Samsung SSD 990 PRO 1TB
Serial Number:                      S6Z1NF0L202025D
Firmware Version:                   8B2QJXD7
PCI Vendor/Subsystem ID:            0x144d
IEEE OUI Identifier:                0x002538
Total NVM Capacity:                 1,000,204,886,016 [1.00 TB]
Unallocated NVM Capacity:           0
Controller ID:                      1
NVMe Version:                       2.0
Number of Namespaces:               1
Namespace 1 Size/Capacity:          1,000,204,886,016 [1.00 TB]
Namespace 1 Utilization:            101,910,757,376 [101 GB]
Namespace 1 Formatted LBA Size:     512
Namespace 1 IEEE EUI-64:            002538 4261b00ca8
Local Time is:                      Mon Apr 20 21:36:16 2026 CEST
Firmware Updates (0x16):            3 Slots, no Reset required
Optional Admin Commands (0x0017):   Security Format Frmw_DL Self_Test
Optional NVM Commands (0x0055):     Comp DS_Mngmt Sav/Sel_Feat Timestmp
Log Page Attributes (0x2f):         S/H_per_NS Cmd_Eff_Lg Ext_Get_Lg Telmtry_Lg Log0_FISE_MI
Maximum Data Transfer Size:         512 Pages
Warning  Comp. Temp. Threshold:     82 Celsius
Critical Comp. Temp. Threshold:     85 Celsius

Supported Power States
St Op     Max   Active     Idle   RL RT WL WT  Ent_Lat  Ex_Lat
 0 +     9.39W       -        -    0  0  0  0        0       0
 1 +     9.39W       -        -    1  1  1  1        0       0
 2 +     9.39W       -        -    2  2  2  2        0       0
 3 -   0.0400W       -        -    3  3  3  3     4200    6800
 4 -   0.0050W       -        -    4  4  4  4     2700   21800

Supported LBA Sizes (NSID 0x1)
Id Fmt  Data  Metadt  Rel_Perf
 0 +     512       0         0

=== START OF SMART DATA SECTION ===
SMART overall-health self-assessment test result: PASSED

SMART/Health Information (NVMe Log 0x02)
Critical Warning:                   0x00
Temperature:                        40 Celsius
Available Spare:                    100%
Available Spare Threshold:          10%
Percentage Used:                    0%
Data Units Read:                    246,698 [126 GB]
Data Units Written:                 317,165 [162 GB]
Host Read Commands:                 1,267,779
Host Write Commands:                7,356,193
Controller Busy Time:               23
Power Cycles:                       29
Power On Hours:                     70
Unsafe Shutdowns:                   16
Media and Data Integrity Errors:    0
Error Information Log Entries:      0
Warning  Comp. Temperature Time:    0
Critical Comp. Temperature Time:    0
Temperature Sensor 1:               40 Celsius
Temperature Sensor 2:               50 Celsius

Error Information (NVMe Log 0x01, 16 of 64 entries)
No Errors Logged

Read Self-test Log failed: Invalid Field in Command (0x002)

=== nvme1n1 ===
smartctl 7.4 2024-10-15 r5620 [x86_64-linux-6.17.13-2-pve] (local build)
Copyright (C) 2002-23, Bruce Allen, Christian Franke, www.smartmontools.org

=== START OF INFORMATION SECTION ===
Model Number:                       Samsung SSD 990 PRO 1TB
Serial Number:                      S7HDNL0L322630L
Firmware Version:                   8B2QJXD7
PCI Vendor/Subsystem ID:            0x144d
IEEE OUI Identifier:                0x002538
Total NVM Capacity:                 1,000,204,886,016 [1.00 TB]
Unallocated NVM Capacity:           0
Controller ID:                      1
NVMe Version:                       2.0
Number of Namespaces:               1
Namespace 1 Size/Capacity:          1,000,204,886,016 [1.00 TB]
Namespace 1 Utilization:            441,590,702,080 [441 GB]
Namespace 1 Formatted LBA Size:     512
Namespace 1 IEEE EUI-64:            002538 4361a07084
Local Time is:                      Mon Apr 20 21:36:16 2026 CEST
Firmware Updates (0x16):            3 Slots, no Reset required
Optional Admin Commands (0x0017):   Security Format Frmw_DL Self_Test
Optional NVM Commands (0x0055):     Comp DS_Mngmt Sav/Sel_Feat Timestmp
Log Page Attributes (0x2f):         S/H_per_NS Cmd_Eff_Lg Ext_Get_Lg Telmtry_Lg Log0_FISE_MI
Maximum Data Transfer Size:         512 Pages
Warning  Comp. Temp. Threshold:     82 Celsius
Critical Comp. Temp. Threshold:     85 Celsius

Supported Power States
St Op     Max   Active     Idle   RL RT WL WT  Ent_Lat  Ex_Lat
 0 +     9.61W       -        -    0  0  0  0        0       0
 1 +     9.61W       -        -    1  1  1  1        0       0
 2 +     9.61W       -        -    2  2  2  2        0       0
 3 -   0.0500W       -        -    3  3  3  3     4200    3500
 4 -   0.0050W       -        -    4  4  4  4     2200   22200

Supported LBA Sizes (NSID 0x1)
Id Fmt  Data  Metadt  Rel_Perf
 0 +     512       0         0

=== START OF SMART DATA SECTION ===
SMART overall-health self-assessment test result: PASSED

SMART/Health Information (NVMe Log 0x02)
Critical Warning:                   0x00
Temperature:                        35 Celsius
Available Spare:                    100%
Available Spare Threshold:          10%
Percentage Used:                    0%
Data Units Read:                    781,216 [399 GB]
Data Units Written:                 879,765 [450 GB]
Host Read Commands:                 3,130,022
Host Write Commands:                3,661,653
Controller Busy Time:               16
Power Cycles:                       28
Power On Hours:                     32
Unsafe Shutdowns:                   16
Media and Data Integrity Errors:    0
Error Information Log Entries:      0
Warning  Comp. Temperature Time:    0
Critical Comp. Temperature Time:    0
Temperature Sensor 1:               35 Celsius
Temperature Sensor 2:               36 Celsius

Error Information (NVMe Log 0x01, 16 of 64 entries)
No Errors Logged

Read Self-test Log failed: Invalid Field in Command (0x002)

=== nvme2n1 ===
smartctl 7.4 2024-10-15 r5620 [x86_64-linux-6.17.13-2-pve] (local build)
Copyright (C) 2002-23, Bruce Allen, Christian Franke, www.smartmontools.org

=== START OF INFORMATION SECTION ===
Model Number:                       Samsung SSD 990 PRO 1TB
Serial Number:                      S7HDNL0L323003J
Firmware Version:                   8B2QJXD7
PCI Vendor/Subsystem ID:            0x144d
IEEE OUI Identifier:                0x002538
Total NVM Capacity:                 1,000,204,886,016 [1.00 TB]
Unallocated NVM Capacity:           0
Controller ID:                      1
NVMe Version:                       2.0
Number of Namespaces:               1
Namespace 1 Size/Capacity:          1,000,204,886,016 [1.00 TB]
Namespace 1 Utilization:            101,910,757,376 [101 GB]
Namespace 1 Formatted LBA Size:     512
Namespace 1 IEEE EUI-64:            002538 4361a071f9
Local Time is:                      Mon Apr 20 21:36:16 2026 CEST
Firmware Updates (0x16):            3 Slots, no Reset required
Optional Admin Commands (0x0017):   Security Format Frmw_DL Self_Test
Optional NVM Commands (0x0055):     Comp DS_Mngmt Sav/Sel_Feat Timestmp
Log Page Attributes (0x2f):         S/H_per_NS Cmd_Eff_Lg Ext_Get_Lg Telmtry_Lg Log0_FISE_MI
Maximum Data Transfer Size:         512 Pages
Warning  Comp. Temp. Threshold:     82 Celsius
Critical Comp. Temp. Threshold:     85 Celsius

Supported Power States
St Op     Max   Active     Idle   RL RT WL WT  Ent_Lat  Ex_Lat
 0 +     9.61W       -        -    0  0  0  0        0       0
 1 +     9.61W       -        -    1  1  1  1        0       0
 2 +     9.61W       -        -    2  2  2  2        0       0
 3 -   0.0500W       -        -    3  3  3  3     4200    3500
 4 -   0.0050W       -        -    4  4  4  4     2200   22200

Supported LBA Sizes (NSID 0x1)
Id Fmt  Data  Metadt  Rel_Perf
 0 +     512       0         0

=== START OF SMART DATA SECTION ===
SMART overall-health self-assessment test result: PASSED

SMART/Health Information (NVMe Log 0x02)
Critical Warning:                   0x00
Temperature:                        41 Celsius
Available Spare:                    100%
Available Spare Threshold:          10%
Percentage Used:                    0%
Data Units Read:                    312,779 [160 GB]
Data Units Written:                 317,309 [162 GB]
Host Read Commands:                 1,546,838
Host Write Commands:                7,709,467
Controller Busy Time:               21
Power Cycles:                       28
Power On Hours:                     70
Unsafe Shutdowns:                   16
Media and Data Integrity Errors:    0
Error Information Log Entries:      0
Warning  Comp. Temperature Time:    0
Critical Comp. Temperature Time:    0
Temperature Sensor 1:               41 Celsius
Temperature Sensor 2:               52 Celsius

Error Information (NVMe Log 0x01, 16 of 64 entries)
No Errors Logged

Read Self-test Log failed: Invalid Field in Command (0x002)

